{
  "provider": "aws",
  "resource_type": "s3",
  "region": "us-east-1",
  "billing_mode": "tiered",
  "rate_per_unit": 0.023,
  "currency": "USD",
  "unit": "GB-month",
  "description": "S3 Standard storage with tiered pricing in us-east-1",
  "assumptions": [
    "S3 Standard storage class",
    "Volume pricing with progressive discounts",
    "First 50 TB at $0.023, next 400 TB at $0.022, over 500 TB at $0.021",
    "Does not include request, transfer, or management fees"
  ],
  "metric_hints": [
    {
      "metric": "storage_gb",
      "unit": "GB",
      "aggregation_method": "avg"
    },
    {
      "metric": "get_requests",
      "unit": "count",
      "aggregation_method": "sum"
    },
    {
      "metric": "put_requests",
      "unit": "count",
      "aggregation_method": "sum"
    }
  ],
  "pricing_tiers": [
    {
      "min_quantity": 0,
      "max_quantity": 50000,
      "rate_per_unit": 0.023,
      "description": "First 50 TB / Month"
    },
    {
      "min_quantity": 50000,
      "max_quantity": 450000,
      "rate_per_unit": 0.022,
      "description": "Next 400 TB / Month"
    },
    {
      "min_quantity": 450000,
      "max_quantity": 0,
      "rate_per_unit": 0.021,
      "description": "Over 500 TB / Month"
    }
  ],
  "time_aggregation": {
    "window": "month",
    "method": "avg",
    "alignment": "billing"
  },
  "resource_tags": {
    "billing_center": "engineering",
    "cost_center": "CC-1001",
    "environment": "production",
    "service": "data-lake"
  },
  "plugin_metadata": {
    "aws_account_id": "123456789012",
    "storage_class": "STANDARD",
    "versioning_enabled": true,
    "lifecycle_policies": true,
    "replication_enabled": false,
    "encryption": "AES256"
  },
  "source": "aws",
  "effective_date": "2024-01-01T00:00:00Z"
}