{
  "provider": "gcp",
  "resource_type": "compute_engine",
  "sku": "n1-standard-1",
  "region": "us-central1",
  "billing_mode": "preemptible",
  "rate_per_unit": 0.01,
  "currency": "USD",
  "description": "Preemptible N1 standard machine with spot pricing",
  "metric_hints": [
    {
      "metric": "vcpu_hours",
      "unit": "hour",
      "aggregation_method": "sum"
    },
    {
      "metric": "memory_gb_hours",
      "unit": "hour",
      "aggregation_method": "sum"
    }
  ],
  "commitment_terms": {
    "duration": "spot",
    "payment_option": "no_upfront",
    "discount_percentage": 79.0
  },
  "time_aggregation": {
    "window": "hour",
    "method": "sum",
    "alignment": "calendar"
  },
  "resource_tags": {
    "billing_center": "ml-engineering",
    "cost_center": "CC-5005",
    "environment": "development",
    "workload": "batch-processing"
  },
  "plugin_metadata": {
    "gcp_project_id": "my-project-123456",
    "machine_family": "general-purpose",
    "vcpu_count": 1,
    "memory_gb": 3.75,
    "preemptible": true,
    "max_run_duration_hours": 24,
    "original_on_demand_price": 0.0475
  },
  "source": "gcp",
  "effective_date": "2024-01-01T00:00:00Z"
}